{
  "case_id": "case_418",
  "title": "No-dedup event counting experiment (v418)",
  "domain": "ads_monetization",
  "unit": "user",
  "variants": [
    "control",
    "test"
  ],
  "time": {
    "start_date": "2025-05-22",
    "end_date": "2025-06-05",
    "horizon_days": 14
  },
  "primary_metric": {
    "name": "revenue",
    "direction": "up",
    "mde_relative": 0.01
  },
  "guardrails": [
    {
      "name": "ctr",
      "direction": "up",
      "max_drop_relative": 0.03
    }
  ],
  "stats": {
    "method": "delta",
    "alpha": 0.05,
    "power_target": 0.8
  },
  "decision_framework": {
    "rule": "ship_if_primary_sig_and_guardrails_ok",
    "practical_threshold_relative": 0.005
  },
  "notes": "Event dedup not applied; client retries may double-count conversions in the test arm."
}
