{
  "case_id": "case_605",
  "title": "Sticky footer unit rollout (v605)",
  "domain": "ads_monetization",
  "unit": "user",
  "variants": [
    "control",
    "test"
  ],
  "time": {
    "start_date": "2025-03-21",
    "end_date": "2025-04-04",
    "horizon_days": 14
  },
  "primary_metric": {
    "name": "revenue",
    "direction": "up",
    "mde_relative": 0.01
  },
  "guardrails": [
    {
      "name": "ctr",
      "direction": "up",
      "max_drop_relative": 0.03
    },
    {
      "name": "dau",
      "direction": "neutral",
      "max_drop_relative": 0.02
    }
  ],
  "stats": {
    "method": "delta",
    "alpha": 0.05,
    "power_target": 0.8
  },
  "decision_framework": {
    "rule": "ship_if_primary_sig_and_guardrails_ok",
    "practical_threshold_relative": 0.007
  },
  "notes": "Experiment #605. Expected engagement trade-off."
}
