{
  "case_id": "case_581",
  "title": "Full-funnel metric scan (v581)",
  "domain": "ads_monetization",
  "unit": "user",
  "variants": [
    "control",
    "test"
  ],
  "time": {
    "start_date": "2025-06-13",
    "end_date": "2025-07-04",
    "horizon_days": 21
  },
  "primary_metric": {
    "name": "revenue",
    "direction": "up",
    "mde_relative": 0.01
  },
  "guardrails": [
    {
      "name": "ctr",
      "direction": "up",
      "max_drop_relative": 0.03
    }
  ],
  "stats": {
    "method": "delta",
    "alpha": 0.05,
    "power_target": 0.8
  },
  "decision_framework": {
    "rule": "ship_if_primary_sig_and_guardrails_ok",
    "practical_threshold_relative": 0.005
  },
  "notes": "8 secondary metrics tested; shows significant at p=0.026 (expected false positive under multiple comparisons). Primary revenue not significant."
}
