{
  "case_id": "case_081",
  "title": "Prebid adapter consolidation (v81)",
  "domain": "ads_monetization",
  "unit": "user",
  "variants": [
    "control",
    "test"
  ],
  "time": {
    "start_date": "2025-06-26",
    "end_date": "2025-07-24",
    "horizon_days": 28
  },
  "primary_metric": {
    "name": "revenue",
    "direction": "up",
    "mde_relative": 0.005
  },
  "guardrails": [
    {
      "name": "ctr",
      "direction": "up",
      "max_drop_relative": 0.03
    }
  ],
  "stats": {
    "method": "delta",
    "alpha": 0.05,
    "power_target": 0.8
  },
  "decision_framework": {
    "rule": "ship_if_primary_sig_and_guardrails_ok",
    "practical_threshold_relative": 0.006
  },
  "notes": "High-power experiment #81. Large sample makes tiny effects significant."
}
