{
  "case_id": "case_211",
  "title": "Staged placement rollout (v211)",
  "domain": "ads_monetization",
  "unit": "user",
  "variants": [
    "control",
    "test"
  ],
  "segments": [
    "feed",
    "article"
  ],
  "time": {
    "start_date": "2025-03-21",
    "end_date": "2025-04-04",
    "horizon_days": 14
  },
  "primary_metric": {
    "name": "revenue",
    "direction": "up",
    "mde_relative": 0.01
  },
  "guardrails": [
    {
      "name": "ctr",
      "direction": "up",
      "max_drop_relative": 0.03
    }
  ],
  "stats": {
    "method": "delta",
    "alpha": 0.05,
    "power_target": 0.8
  },
  "decision_framework": {
    "rule": "ship_if_primary_sig_and_guardrails_ok",
    "practical_threshold_relative": 0.005
  },
  "notes": "Experiment #211. Rollout note: in the test arm the new placement went live on feed first, so that segment accounts for 37% of test traffic against 32% in control. Overall group sizes match the planned 50/50 split."
}
