{
  "case_id": "case_594",
  "title": "Cart-abandon rescue widget (v594)",
  "domain": "ads_monetization",
  "unit": "user",
  "variants": [
    "control",
    "test"
  ],
  "time": {
    "start_date": "2025-06-14",
    "end_date": "2025-06-28",
    "horizon_days": 14
  },
  "primary_metric": {
    "name": "revenue",
    "direction": "up",
    "mde_relative": 0.01
  },
  "guardrails": [
    {
      "name": "ctr",
      "direction": "up",
      "max_drop_relative": 0.03
    }
  ],
  "stats": {
    "method": "delta",
    "alpha": 0.05,
    "power_target": 0.8
  },
  "decision_framework": {
    "rule": "ship_if_primary_sig_and_guardrails_ok",
    "practical_threshold_relative": 0.005
  },
  "notes": "Feature triggers only for users hitting the checkout error path (~6% of assigned users). Analysis is intent-to-treat over the full randomized population — non-triggered users contribute zeros and dilute the measured effect."
}
