{
  "case_id": "case_677",
  "title": "Creative size mix expansion (v677)",
  "domain": "ads_monetization",
  "unit": "user",
  "variants": [
    "control",
    "test"
  ],
  "time": {
    "start_date": "2025-09-23",
    "end_date": "2025-10-07",
    "horizon_days": 14
  },
  "primary_metric": {
    "name": "revenue",
    "direction": "up",
    "mde_relative": 0.005
  },
  "guardrails": [
    {
      "name": "ctr",
      "direction": "up",
      "max_drop_relative": 0.03
    },
    {
      "name": "dau",
      "direction": "neutral",
      "max_drop_relative": 0.02
    }
  ],
  "stats": {
    "method": "delta",
    "alpha": 0.05,
    "power_target": 0.8
  },
  "decision_framework": {
    "rule": "ship_if_primary_sig_and_guardrails_ok",
    "practical_threshold_relative": 0.003
  },
  "notes": "Standard experiment #677. Clean uplift expected."
}
