{
  "case_id": "case_352",
  "title": "Sticky footer unit rollout (v352)",
  "domain": "ads_monetization",
  "unit": "user",
  "variants": [
    "control",
    "test"
  ],
  "time": {
    "start_date": "2025-01-01",
    "end_date": "2025-01-15",
    "horizon_days": 14
  },
  "primary_metric": {
    "name": "ctr",
    "direction": "up",
    "mde_relative": 0.01
  },
  "guardrails": [
    {
      "name": "revenue",
      "direction": "up",
      "max_drop_relative": 0.02
    },
    {
      "name": "retention",
      "direction": "up",
      "max_drop_relative": 0.02
    }
  ],
  "stats": {
    "method": "delta",
    "alpha": 0.05,
    "power_target": 0.8
  },
  "decision_framework": {
    "rule": "ship_if_primary_sig_and_guardrails_ok",
    "practical_threshold_relative": 0.005
  },
  "notes": "Experiment optimizing CTR (engagement proxy). Primary CTR +6% significant. Business guardrails in export: revenue -3.2% (p=0.019), D7 retention test 44.3% vs control 45.6% (−2.8% relative)."
}
