{
  "case_id": "case_115",
  "title": "Social invite reward banner (v115)",
  "domain": "ads_monetization",
  "unit": "user",
  "variants": [
    "control",
    "test"
  ],
  "time": {
    "start_date": "2025-04-26",
    "end_date": "2025-05-17",
    "horizon_days": 21
  },
  "primary_metric": {
    "name": "revenue",
    "direction": "up",
    "mde_relative": 0.01
  },
  "guardrails": [
    {
      "name": "ctr",
      "direction": "up",
      "max_drop_relative": 0.03
    }
  ],
  "stats": {
    "method": "delta",
    "alpha": 0.05,
    "power_target": 0.8
  },
  "decision_framework": {
    "rule": "ship_if_primary_sig_and_guardrails_ok",
    "practical_threshold_relative": 0.005
  },
  "notes": "Feature is socially shareable — users can forward referral links / shared account access to friends. Estimated ~16% of control users may receive partial exposure via leakage (contamination), diluting the contrast."
}
