{
  "case_id": "case_603",
  "title": "Click surface expansion test (v603)",
  "domain": "ads_monetization",
  "unit": "user",
  "variants": [
    "control",
    "test"
  ],
  "time": {
    "start_date": "2025-06-19",
    "end_date": "2025-07-03",
    "horizon_days": 14
  },
  "primary_metric": {
    "name": "ctr",
    "direction": "up",
    "mde_relative": 0.01
  },
  "guardrails": [
    {
      "name": "retention",
      "direction": "up",
      "max_drop_relative": 0.02
    },
    {
      "name": "revenue",
      "direction": "up",
      "max_drop_relative": 0.02
    }
  ],
  "stats": {
    "method": "delta",
    "alpha": 0.05,
    "power_target": 0.8
  },
  "decision_framework": {
    "rule": "ship_if_primary_sig_and_guardrails_ok",
    "practical_threshold_relative": 0.005
  },
  "notes": "Primary readout is short-term CTR (engagement proxy). Cohort panel: D7 retention test 42.2% vs control 44.6% (−5.4% relative, breaches 2% guardrail)."
}
