{
  "case_id": "case_298",
  "title": "Platform-specific layout experiment (v298)",
  "domain": "ads_monetization",
  "unit": "user",
  "variants": [
    "control",
    "test"
  ],
  "segments": [
    "desktop",
    "mobile"
  ],
  "time": {
    "start_date": "2025-02-15",
    "end_date": "2025-03-01",
    "horizon_days": 14
  },
  "primary_metric": {
    "name": "revenue",
    "direction": "up",
    "mde_relative": 0.01
  },
  "guardrails": [
    {
      "name": "ctr",
      "direction": "up",
      "max_drop_relative": 0.03
    }
  ],
  "stats": {
    "method": "delta",
    "alpha": 0.05,
    "power_target": 0.8
  },
  "decision_framework": {
    "rule": "ship_if_primary_sig_and_guardrails_ok",
    "practical_threshold_relative": 0.005
  },
  "notes": "Overall effect modest (+1.1%). Segment readout: desktop +5.6% vs mobile -0.1% — team recommends rolling out on desktop only. No formal interaction test; no multiplicity correction across segments."
}
